{
  "$schema": "../schemas/condition.schema.json",
  "schemaVersion": 1,
  "id": "workflow-detector",
  "label": "Workflow and detector comparison skill",
  "category": "competitor",
  "status": "pending-selection-and-license-review",
  "source": {
    "kind": "external-skill",
    "repository": null,
    "commit": null,
    "license": "to-be-verified"
  },
  "runtime": {
    "instructionSurface": "Use the selected skill's documented workflow, hooks, and detectors when they fit the common tool and budget contract.",
    "installMethod": "to-be-pinned",
    "effectiveContextSha256": null
  },
  "capabilities": {
    "commonToolsOnly": true,
    "networkDuringRun": false,
    "imageGenerationCalls": 0
  },
  "runReady": false,
  "unresolved": [
    "public candidate selection",
    "license and redistribution review",
    "source commit",
    "effective runtime context hash",
    "common model snapshot",
    "starter commit"
  ]
}

